{
  "$schema": "./schema.json",
  "id": "orbital-habitat",
  "title": "Sustainable Orbital Habitat",
  "tagline": "Skyship · the orbital habitat's Life Support Commons",
  "summary": "Through the ring habitat and the biosphere dome to the four life-support stations.",
  "duration": 54,
  "transition": 3,
  "timelineLabel": "LIFE SUPPORT COMMONS",
  "categories": [
    "space",
    "sustainability"
  ],
  "worlds": [
    {
      "world": "orbital-habitat",
      "t0": 0,
      "t1": 54,
      "timeOffset": 116
    }
  ],
  "cues": [
    {
      "t": 0,
      "mood": "amazed",
      "look": "down",
      "slot": "R",
      "line": "Earth, below. Let's visit a habitat built to sustain life."
    },
    {
      "t": 12,
      "mood": "happy",
      "look": "ring",
      "point": true,
      "slot": "R",
      "line": "A ring habitat, spinning to make gravity."
    },
    {
      "t": 15.5,
      "mood": "excited",
      "look": "up",
      "gesture": "spin",
      "slot": "R",
      "line": "Straight through the middle!"
    },
    {
      "t": 20.5,
      "mood": "happy",
      "look": "falls",
      "point": true,
      "slot": "R",
      "line": "Forest, lake, waterfall. Water used again and again."
    },
    {
      "t": 28.5,
      "mood": "curious",
      "look": "farm",
      "point": true,
      "slot": "L",
      "line": "The Life Support Commons. First: food."
    },
    {
      "t": 32.5,
      "mood": "happy",
      "look": "water",
      "point": true,
      "slot": "L",
      "line": "Water, cleaned and used again. Almost nothing lost."
    },
    {
      "t": 36.5,
      "mood": "amazed",
      "look": "energy",
      "point": true,
      "slot": "L",
      "line": "Sunlight in, stored for the dark side of the orbit."
    },
    {
      "t": 40.5,
      "mood": "happy",
      "look": "air",
      "point": true,
      "slot": "L",
      "line": "Algae breathe in our CO2 and breathe out oxygen."
    },
    {
      "t": 44.5,
      "mood": "thoughtful",
      "look": "earthView",
      "slot": "R",
      "line": "A city or a habitat: both have to keep life going."
    },
    {
      "t": 48.5,
      "mood": "happy",
      "look": "you",
      "gesture": "wave",
      "slot": "R"
    }
  ],
  "audio": {
    "file": "../journeys/audio/orbital-habitat.mp3"
  },
  "final": {
    "t0": 46,
    "line1": "Food · Water · Energy · Air.",
    "line2": "Sustaining Life Is Our Responsibility.",
    "foot": "FUTURE LIFE EXPERIENCES · ORBITAL HABITAT"
  },
  "lesson": {
    "title": "Life Support in Orbit",
    "course": "Virtual Environments for a Better Future",
    "intro": "A habitat has to make everything its people need. Investigate each station.",
    "objectives": [
      {
        "text": "Explain how a habitat recycles water and air.",
        "hotspots": [
          "water",
          "air"
        ]
      },
      {
        "text": "Explain how a habitat grows food and stores energy.",
        "hotspots": [
          "farm",
          "energy"
        ]
      },
      {
        "text": "Compare: which needs are the same in the city and in orbit?",
        "hotspots": [
          "ring",
          "dome"
        ]
      }
    ]
  },
  "shots": [
    [
      9,
      "orbit_earth",
      "cabin",
      0,
      -0.6
    ],
    [
      15,
      "orbit_ring",
      "cabin",
      0,
      0.05
    ],
    [
      24,
      "orbit_dome",
      "cabin",
      -1.1,
      -0.15
    ],
    [
      31,
      "orbit_farm",
      "cabin",
      1.25,
      0
    ],
    [
      35,
      "orbit_water",
      "cabin",
      1.3,
      -0.05
    ],
    [
      39,
      "orbit_energy",
      "cabin",
      1.25,
      0.05
    ],
    [
      43,
      "orbit_air",
      "cabin",
      1.25,
      0
    ],
    [
      48,
      "final_message",
      "cabin",
      0,
      0.12
    ]
  ]
}
